{"authorizations":{"calibration_development_run_authorized":false,"dvc_commands_authorized":false,"dvc_push_authorized":false,"e0_m_authorized":false,"e0_u_authorized":false,"e7_learning_curve_run_authorized":false,"effective_in_payload":false,"git_commit_authorized":false,"git_push_authorized":false,"holdout_access_authorized":false,"locked_evaluation_authorized":false,"outcome_access_authorized":false,"post_2021_access_authorized":false,"r8_staging_authorized":false,"scientific_network_authorized":false},"coordination_namespace":{"coordination_forbidden_count":49,"coordination_present_count":0,"current_lock_present_count":0,"formal_e0_m_output_present_count":0,"historical_published_lock_count":20,"historical_published_locks":[{"bytes":115014,"git_mode":"100644","git_oid":"a1af5d15b20682089c2545d6048979be0291e72e","path":"reports/closure_v1/00_protocol/final_calibration_candidate_semantics_patch_lock.json","role":"historical_published_final_calibration_lock","sha256":"307b6365acf91f5d5d91eb9a6c7f9486619bb114a92db091d16ad57d692bfd8c"},{"bytes":5549,"git_mode":"100644","git_oid":"5ebedf28502ed9193accda83972ff27be9532dad","path":"reports/closure_v1/00_protocol/final_calibration_candidate_semantics_patch_lock_manifest.json","role":"historical_published_final_calibration_lock","sha256":"328976b2316e74f10e8979ba126b2e292b3a4e0483946415f4b9c8a7e1c96977"},{"bytes":116090,"git_mode":"100644","git_oid":"cf0690c0648ba5316d553aec477fd36ba5a2e285","path":"reports/closure_v1/00_protocol/final_calibration_inference_role_patch_lock.json","role":"historical_published_final_calibration_lock","sha256":"42a5fdf8d5667472579ebfbb195f3229c65c5f35bd212c48c1cebcc80080bb66"},{"bytes":5468,"git_mode":"100644","git_oid":"ba622a09d4a07f156bdb4f9d98a3c314fc52144f","path":"reports/closure_v1/00_protocol/final_calibration_inference_role_patch_lock_manifest.json","role":"historical_published_final_calibration_lock","sha256":"9d76be00b65901d4960ee0b01ccc71af669ee8ca5e76fbb268ded0449de40a91"},{"bytes":121402,"git_mode":"100644","git_oid":"c20be10ecbab19e41efb800122028eb88db71d36","path":"reports/closure_v1/00_protocol/final_calibration_observed_risk_precision_patch_lock.json","role":"historical_published_final_calibration_lock","sha256":"07611cb18dbac1c897387be85af8d12ce88296ec787928802a3baea854cd503c"},{"bytes":5703,"git_mode":"100644","git_oid":"04605385275dcb3283c1a4f646e74efe72aef7e3","path":"reports/closure_v1/00_protocol/final_calibration_observed_risk_precision_patch_lock_manifest.json","role":"historical_published_final_calibration_lock","sha256":"812f74d62df70fd98a3b76f7d5375ac26bec1f36f6c1a6486ff54a05ad3a07f4"},{"bytes":119633,"git_mode":"100644","git_oid":"20090b2f8928e5943d2041095db0d58e51b52e47","path":"reports/closure_v1/00_protocol/final_calibration_ordinal_label_representation_patch_lock.json","role":"historical_published_final_calibration_lock","sha256":"bc0ab48f68a81308736c44e4fd88a603d7ae486f8537fa9ec02884d4df5a568e"},{"bytes":5756,"git_mode":"100644","git_oid":"ef9a2f27217a8ee3282f243f2a072714e40e7b8b","path":"reports/closure_v1/00_protocol/final_calibration_ordinal_label_representation_patch_lock_manifest.json","role":"historical_published_final_calibration_lock","sha256":"e072e190734065dfc82bf79290a7f3a61ac842dff8ffb64a0f61da8dcb3f6994"},{"bytes":123665,"git_mode":"100644","git_oid":"73d787d6f32e7962d905c83cd43948bc37c5f869","path":"reports/closure_v1/00_protocol/final_calibration_owned_run_guard_revalidation_patch_lock.json","role":"historical_published_final_calibration_lock","sha256":"87ca3e792de22fb8b20cacf85c601df28989ff5c3d475a533e588cd659f8d393"},{"bytes":5766,"git_mode":"100644","git_oid":"50b7ce7c76236e486942a6d65cb8387320615fe8","path":"reports/closure_v1/00_protocol/final_calibration_owned_run_guard_revalidation_patch_lock_manifest.json","role":"historical_published_final_calibration_lock","sha256":"e1584d67ada4d34312cd06aba7ff7437c2cb96e18550e561b0b438771602602e"},{"bytes":126155,"git_mode":"100644","git_oid":"d8bd3c3d4b2c0804f3f88d7dc517fc0f559de38e","path":"reports/closure_v1/00_protocol/final_calibration_platt_parameter_dialect_patch_lock.json","role":"historical_published_final_calibration_lock","sha256":"149944e42c75d40f77f3cfb58c4f844c2e274cf53b02d020e0c98f083a972ba5"},{"bytes":5707,"git_mode":"100644","git_oid":"fa637bebda6de7ffcc1b4503ec2db4224859f418","path":"reports/closure_v1/00_protocol/final_calibration_platt_parameter_dialect_patch_lock_manifest.json","role":"historical_published_final_calibration_lock","sha256":"86a2527c35df3de48c543542794d99bf182a8dd04a9540049f9eb6fe69c15079"},{"bytes":112446,"git_mode":"100644","git_oid":"e0020e76bf032670411396b59d4d75caa2bc8468","path":"reports/closure_v1/00_protocol/final_calibration_publication_guard_patch_lock.json","role":"historical_published_final_calibration_lock","sha256":"799d9758e03259db0d41e5cd4547c9648009d4d03444724cbd916ef432eaf32f"},{"bytes":5495,"git_mode":"100644","git_oid":"e70f220e25c0d8c7b7f377d24d21fa99d977f7ef","path":"reports/closure_v1/00_protocol/final_calibration_publication_guard_patch_lock_manifest.json","role":"historical_published_final_calibration_lock","sha256":"0617f00bd054e1d7cd702a7185bfbe95085db8b94c619a7d2356f2e26bfca9d7"},{"bytes":31172,"git_mode":"100644","git_oid":"17777de18d415fd8dbe63431ae0f8e76b5d3b636","path":"reports/closure_v1/00_protocol/final_calibration_r8_coordination_namespace_revalidation_patch_lock.json","role":"published_p_mcall_lock","sha256":"5b7ca63ceeb72a86c234c66f733b98a91c741fa9d5b8cdd7f85bad8117bb15b8"},{"bytes":6527,"git_mode":"100644","git_oid":"73e4f17c604db135bc9453ec04098cf78e144580","path":"reports/closure_v1/00_protocol/final_calibration_r8_coordination_namespace_revalidation_patch_lock_manifest.json","role":"published_p_mcall_lock_manifest","sha256":"70f00fadd8f0a0a23e02050c02b8f93e22fb8de06fb348455eaff4656ec6c0d7"},{"bytes":118993,"git_mode":"100644","git_oid":"43b3d378dd4d0ea2d8a3b1690e191c645488e25f","path":"reports/closure_v1/00_protocol/final_calibration_raw_exclusion_evidence_patch_lock.json","role":"historical_published_final_calibration_lock","sha256":"1683d179e50c4e0d09f6dba22798635f13a541fe3cf5ecd20da76efba256fca3"},{"bytes":5643,"git_mode":"100644","git_oid":"390a3eae31de5076b6fb6822bb85e7b91c13d051","path":"reports/closure_v1/00_protocol/final_calibration_raw_exclusion_evidence_patch_lock_manifest.json","role":"historical_published_final_calibration_lock","sha256":"4d0a607a818955f97b026fddcdd203f33cdd228d5613f64e74e500a8cbdc0565"},{"bytes":117589,"git_mode":"100644","git_oid":"fe8fe7f14f44f4079b45e92c4e1417c0215aba1e","path":"reports/closure_v1/00_protocol/final_calibration_target_filter_evidence_patch_lock.json","role":"historical_published_final_calibration_lock","sha256":"4700c1d76d74f4e3a7b627bcd9ebd5708d8c784be134b005dccd81d5f405183f"},{"bytes":5586,"git_mode":"100644","git_oid":"bac3d9db545ac6253293d9eea51e1bc14eb42e33","path":"reports/closure_v1/00_protocol/final_calibration_target_filter_evidence_patch_lock_manifest.json","role":"historical_published_final_calibration_lock","sha256":"51572df834cc8200ee3bc5eca42106947ead86e020327957bea2ca427b95626f"}],"historical_published_locks_sha256":"9f2c6aea0babd7ffb16410bf11abc3e9fc753005468fb88cfacda6b57905f89a","never_published_lock_present_count":0,"outcome_access_log_absent":true,"owned_current_guard_present":false},"coordination_namespace_contract":{"coordination_forbidden_count":49,"current_lock_count":2,"current_lock_paths":["reports/closure_v1/00_protocol/final_calibration_r8_post_publication_authority_patch_lock.json","reports/closure_v1/00_protocol/final_calibration_r8_post_publication_authority_patch_lock_manifest.json"],"effective_loader_revalidation_required":true,"historical_published_lock_count":20,"historical_published_lock_paths":["reports/closure_v1/00_protocol/final_calibration_candidate_semantics_patch_lock.json","reports/closure_v1/00_protocol/final_calibration_candidate_semantics_patch_lock_manifest.json","reports/closure_v1/00_protocol/final_calibration_inference_role_patch_lock.json","reports/closure_v1/00_protocol/final_calibration_inference_role_patch_lock_manifest.json","reports/closure_v1/00_protocol/final_calibration_observed_risk_precision_patch_lock.json","reports/closure_v1/00_protocol/final_calibration_observed_risk_precision_patch_lock_manifest.json","reports/closure_v1/00_protocol/final_calibration_ordinal_label_representation_patch_lock.json","reports/closure_v1/00_protocol/final_calibration_ordinal_label_representation_patch_lock_manifest.json","reports/closure_v1/00_protocol/final_calibration_owned_run_guard_revalidation_patch_lock.json","reports/closure_v1/00_protocol/final_calibration_owned_run_guard_revalidation_patch_lock_manifest.json","reports/closure_v1/00_protocol/final_calibration_platt_parameter_dialect_patch_lock.json","reports/closure_v1/00_protocol/final_calibration_platt_parameter_dialect_patch_lock_manifest.json","reports/closure_v1/00_protocol/final_calibration_publication_guard_patch_lock.json","reports/closure_v1/00_protocol/final_calibration_publication_guard_patch_lock_manifest.json","reports/closure_v1/00_protocol/final_calibration_r8_coordination_namespace_revalidation_patch_lock.json","reports/closure_v1/00_protocol/final_calibration_r8_coordination_namespace_revalidation_patch_lock_manifest.json","reports/closure_v1/00_protocol/final_calibration_raw_exclusion_evidence_patch_lock.json","reports/closure_v1/00_protocol/final_calibration_raw_exclusion_evidence_patch_lock_manifest.json","reports/closure_v1/00_protocol/final_calibration_target_filter_evidence_patch_lock.json","reports/closure_v1/00_protocol/final_calibration_target_filter_evidence_patch_lock_manifest.json"],"lock_temporary_count":26,"lock_temporary_paths":["reports/closure_v1/00_protocol/final_calibration_candidate_semantics_patch_lock.json.tmp","reports/closure_v1/00_protocol/final_calibration_candidate_semantics_patch_lock_manifest.json.tmp","reports/closure_v1/00_protocol/final_calibration_inference_role_patc